{
  "$schema": "https://the-sovereign/ttcl-specs/temple-grid-schema.json",
  "grid_id": "enheduanna-temple-grid",
  "schema_version": "1.2.0",
  "provenance": {
    "author": "Enheduanna",
    "era": "c. 2300 BCE",
    "corpus": "Temple Hymns (42)",
    "source_refs": [
      "ETCSL t.4.80.1 The temple hymns (Oxford)",
      "Sjöberg, Å.W. & Bergmann, E. The Collection of the Sumerian Temple Hymns (TCS 3)",
      "theo-techno-cosmo/Wheel/8 wheels and 3 domains.docx",
      "docs:IV-Grid-of-the-Universe"
    ],
    "ttc_domain": "THEO_TECHNO_COSMO"
  },
  "semantics": {
    "theology_mode": "polytheism-networked-system",
    "technology_mode": "semantic-protocol",
    "cosmology_mode": "underlying-grid",
    "wheel_binding": {
      "bound_wheels": [
        "Teologia",
        "Kosmologia",
        "Technologia"
      ],
      "rotation_policy": {
        "policy_id": "enheduanna-grid-rotation",
        "mode": "include-all",
        "constraints": [
          "all-42-hymns-present",
          "prefer-active-over-unknown",
          "weight-major-hubs-higher",
          "at-least-one-node-per-known-city"
        ]
      },
      "slot_mapping": [
        {
          "temple_id": "temple-eridu-e-engura",
          "wheel_id": "Teologia",
          "slot_id": "B",
          "weight": 1
        },
        {
          "temple_id": "temple-nippur-e-kur",
          "wheel_id": "Teologia",
          "slot_id": "C",
          "weight": 1
        },
        {
          "temple_id": "temple-nippur-e-tummal",
          "wheel_id": "Teologia",
          "slot_id": "D",
          "weight": 1
        },
        {
          "temple_id": "temple-nippur-e-melem-hush",
          "wheel_id": "Teologia",
          "slot_id": "E",
          "weight": 1
        },
        {
          "temple_id": "temple-nippur-e-shu-me-sha",
          "wheel_id": "Teologia",
          "slot_id": "F",
          "weight": 1
        },
        {
          "temple_id": "temple-ga-gi-mah-e-ga-duda",
          "wheel_id": "Teologia",
          "slot_id": "G",
          "weight": 1
        },
        {
          "temple_id": "temple-kesh-e-kesh",
          "wheel_id": "Teologia",
          "slot_id": "H",
          "weight": 1
        },
        {
          "temple_id": "temple-ur-e-kish-nu-gal",
          "wheel_id": "Teologia",
          "slot_id": "I",
          "weight": 1
        },
        {
          "temple_id": "temple-ur-e-hursag-shulgi",
          "wheel_id": "Teologia",
          "slot_id": "K",
          "weight": 1
        },
        {
          "temple_id": "temple-kuara-e-kuara",
          "wheel_id": "Teologia",
          "slot_id": "L",
          "weight": 1
        },
        {
          "temple_id": "temple-ki-abrig-e-gud-du-shar",
          "wheel_id": "Teologia",
          "slot_id": "M",
          "weight": 1
        },
        {
          "temple_id": "temple-gaesh-kar-zida",
          "wheel_id": "Teologia",
          "slot_id": "N",
          "weight": 1
        },
        {
          "temple_id": "temple-larsam-e-babbar-larsam",
          "wheel_id": "Teologia",
          "slot_id": "O",
          "weight": 1
        },
        {
          "temple_id": "temple-enegir-e-gida",
          "wheel_id": "Teologia",
          "slot_id": "P",
          "weight": 1
        },
        {
          "temple_id": "temple-gishbanda-e-gishbanda",
          "wheel_id": "Teologia",
          "slot_id": "Q",
          "weight": 1
        },
        {
          "temple_id": "temple-uruk-e-ana",
          "wheel_id": "Teologia",
          "slot_id": "R",
          "weight": 1
        },
        {
          "temple_id": "temple-eridu-e-engura",
          "wheel_id": "Kosmologia",
          "slot_id": "B",
          "weight": 1
        },
        {
          "temple_id": "temple-nippur-e-kur",
          "wheel_id": "Kosmologia",
          "slot_id": "C",
          "weight": 1
        },
        {
          "temple_id": "temple-nippur-e-tummal",
          "wheel_id": "Kosmologia",
          "slot_id": "D",
          "weight": 1
        },
        {
          "temple_id": "temple-nippur-e-melem-hush",
          "wheel_id": "Kosmologia",
          "slot_id": "E",
          "weight": 1
        },
        {
          "temple_id": "temple-nippur-e-shu-me-sha",
          "wheel_id": "Kosmologia",
          "slot_id": "F",
          "weight": 1
        },
        {
          "temple_id": "temple-ga-gi-mah-e-ga-duda",
          "wheel_id": "Kosmologia",
          "slot_id": "G",
          "weight": 1
        },
        {
          "temple_id": "temple-kesh-e-kesh",
          "wheel_id": "Kosmologia",
          "slot_id": "H",
          "weight": 1
        },
        {
          "temple_id": "temple-ur-e-kish-nu-gal",
          "wheel_id": "Kosmologia",
          "slot_id": "I",
          "weight": 1
        },
        {
          "temple_id": "temple-ur-e-hursag-shulgi",
          "wheel_id": "Kosmologia",
          "slot_id": "K",
          "weight": 1
        },
        {
          "temple_id": "temple-kuara-e-kuara",
          "wheel_id": "Kosmologia",
          "slot_id": "L",
          "weight": 1
        },
        {
          "temple_id": "temple-ki-abrig-e-gud-du-shar",
          "wheel_id": "Kosmologia",
          "slot_id": "M",
          "weight": 1
        },
        {
          "temple_id": "temple-gaesh-kar-zida",
          "wheel_id": "Kosmologia",
          "slot_id": "N",
          "weight": 1
        },
        {
          "temple_id": "temple-larsam-e-babbar-larsam",
          "wheel_id": "Kosmologia",
          "slot_id": "O",
          "weight": 1
        },
        {
          "temple_id": "temple-enegir-e-gida",
          "wheel_id": "Kosmologia",
          "slot_id": "P",
          "weight": 1
        },
        {
          "temple_id": "temple-gishbanda-e-gishbanda",
          "wheel_id": "Kosmologia",
          "slot_id": "Q",
          "weight": 1
        },
        {
          "temple_id": "temple-uruk-e-ana",
          "wheel_id": "Kosmologia",
          "slot_id": "R",
          "weight": 1
        },
        {
          "temple_id": "temple-eridu-e-engura",
          "wheel_id": "Technologia",
          "slot_id": "B",
          "weight": 1
        },
        {
          "temple_id": "temple-nippur-e-kur",
          "wheel_id": "Technologia",
          "slot_id": "C",
          "weight": 1
        },
        {
          "temple_id": "temple-nippur-e-tummal",
          "wheel_id": "Technologia",
          "slot_id": "D",
          "weight": 1
        },
        {
          "temple_id": "temple-nippur-e-melem-hush",
          "wheel_id": "Technologia",
          "slot_id": "E",
          "weight": 1
        },
        {
          "temple_id": "temple-nippur-e-shu-me-sha",
          "wheel_id": "Technologia",
          "slot_id": "F",
          "weight": 1
        },
        {
          "temple_id": "temple-ga-gi-mah-e-ga-duda",
          "wheel_id": "Technologia",
          "slot_id": "G",
          "weight": 1
        },
        {
          "temple_id": "temple-kesh-e-kesh",
          "wheel_id": "Technologia",
          "slot_id": "H",
          "weight": 1
        },
        {
          "temple_id": "temple-ur-e-kish-nu-gal",
          "wheel_id": "Technologia",
          "slot_id": "I",
          "weight": 1
        },
        {
          "temple_id": "temple-ur-e-hursag-shulgi",
          "wheel_id": "Technologia",
          "slot_id": "K",
          "weight": 1
        },
        {
          "temple_id": "temple-kuara-e-kuara",
          "wheel_id": "Technologia",
          "slot_id": "L",
          "weight": 1
        },
        {
          "temple_id": "temple-ki-abrig-e-gud-du-shar",
          "wheel_id": "Technologia",
          "slot_id": "M",
          "weight": 1
        },
        {
          "temple_id": "temple-gaesh-kar-zida",
          "wheel_id": "Technologia",
          "slot_id": "N",
          "weight": 1
        },
        {
          "temple_id": "temple-larsam-e-babbar-larsam",
          "wheel_id": "Technologia",
          "slot_id": "O",
          "weight": 1
        },
        {
          "temple_id": "temple-enegir-e-gida",
          "wheel_id": "Technologia",
          "slot_id": "P",
          "weight": 1
        },
        {
          "temple_id": "temple-gishbanda-e-gishbanda",
          "wheel_id": "Technologia",
          "slot_id": "Q",
          "weight": 1
        },
        {
          "temple_id": "temple-uruk-e-ana",
          "wheel_id": "Technologia",
          "slot_id": "R",
          "weight": 1
        },
        {
          "temple_id": "temple-bad-tibira-e-mush",
          "wheel_id": "Kosmologia",
          "slot_id": "B",
          "weight": 0.6
        },
        {
          "temple_id": "temple-akkil-e-akkil",
          "wheel_id": "Technologia",
          "slot_id": "C",
          "weight": 0.6
        },
        {
          "temple_id": "temple-murum-e-murum",
          "wheel_id": "Teologia",
          "slot_id": "D",
          "weight": 0.6
        },
        {
          "temple_id": "temple-lagash-e-ninnu",
          "wheel_id": "Kosmologia",
          "slot_id": "E",
          "weight": 0.6
        },
        {
          "temple_id": "temple-iri-kug-e-iri-kug",
          "wheel_id": "Technologia",
          "slot_id": "F",
          "weight": 0.6
        },
        {
          "temple_id": "temple-sirara-e-sirara",
          "wheel_id": "Teologia",
          "slot_id": "G",
          "weight": 0.6
        },
        {
          "temple_id": "temple-gu-aba-e-ab-shaga-la",
          "wheel_id": "Kosmologia",
          "slot_id": "H",
          "weight": 0.6
        },
        {
          "temple_id": "temple-kinirsha-e-kinirsha",
          "wheel_id": "Technologia",
          "slot_id": "I",
          "weight": 0.6
        },
        {
          "temple_id": "temple-umma-e-mah-umma",
          "wheel_id": "Teologia",
          "slot_id": "K",
          "weight": 0.6